{"$id":"https://offdata.local/schemas/pcfa07-codex-implementation-backlog-reconciliation.schema.json","$schema":"https://json-schema.org/draft/2020-12/schema","additionalProperties":false,"properties":{"backlog_projection":{"additionalProperties":false,"properties":{"existing_imp_phase_count":{"const":13},"existing_task_count":{"const":53},"new_imp_phase_count":{"const":0},"new_task_count":{"const":0},"phase0_new_obligation_count":{"const":0},"phase0_tasks_unchanged":{"const":["P0.1","P0.2","P0.3","P0.4"]}},"required":["existing_imp_phase_count","existing_task_count","new_imp_phase_count","new_task_count","phase0_new_obligation_count","phase0_tasks_unchanged"],"type":"object"},"boundaries":{"additionalProperties":{"type":"boolean"},"required":["founder_accountability_preserved","phase0_implementation_authorized","phase0_merge_authorized","phase1_authorized","merge_authorized","runtime_activation_authorized","hermes_activation_authorized","real_client_data_enabled","external_actions_authorized","paid_services_authorized","oauth_authorized","production_deployment_authorized","autonomous_merge_authorized","codex_start_authorized"],"type":"object"},"derivation_rules":{"additionalProperties":false,"properties":{"blocking_phase_gate":{"const":"IMP phase of primary_implementation_task"},"component_bindings":{"const":"ordered union of task_component_map entries for task_bindings"},"dependency_tasks":{"const":"all task_bindings entries before primary"},"primary_implementation_task":{"const":"last task_bindings entry"}},"required":["primary_implementation_task","blocking_phase_gate","dependency_tasks","component_bindings"],"type":"object"},"expected_counts":{"additionalProperties":false,"properties":{"pcfa04_requirements":{"const":29},"pcfa05_founder_interrupts":{"const":6},"pcfa05_invariants":{"const":15},"pcfa05_negative_cases":{"const":13},"pcfa05_stages":{"const":19},"pcfa06_capabilities":{"const":11},"planned_tests":{"const":93},"total_obligations":{"const":93}},"required":["pcfa04_requirements","pcfa05_stages","pcfa05_invariants","pcfa05_negative_cases","pcfa05_founder_interrupts","pcfa06_capabilities","total_obligations","planned_tests"],"type":"object"},"generated_from":{"const":"configs/pcfa07-codex-implementation-backlog-reconciliation.yaml"},"kind_metadata":{"additionalProperties":{"additionalProperties":false,"properties":{"evidence_type":{"minLength":1,"type":"string"},"source_work_package":{"enum":["PCFA-04","PCFA-05","PCFA-06"]}},"required":["source_work_package","evidence_type"],"type":"object"},"maxProperties":7,"minProperties":7,"type":"object"},"obligation_columns":{"items":false,"maxItems":4,"minItems":4,"prefixItems":[{"const":"requirement_id"},{"const":"obligation_kind"},{"const":"task_bindings"},{"const":"planned_test_id"}],"type":"array"},"obligation_counts":{"additionalProperties":false,"properties":{"pcfa04_requirements":{"const":29},"pcfa05_founder_interrupts":{"const":6},"pcfa05_invariants":{"const":15},"pcfa05_negative_cases":{"const":13},"pcfa05_stages":{"const":19},"pcfa06_capabilities":{"const":11},"planned_tests":{"const":93},"total_obligations":{"const":93}},"required":["pcfa04_requirements","pcfa05_stages","pcfa05_invariants","pcfa05_negative_cases","pcfa05_founder_interrupts","pcfa06_capabilities","total_obligations","planned_tests"],"type":"object"},"obligation_defaults":{"additionalProperties":false,"properties":{"implementation_evidence_status":{"const":"not_available_pre_implementation"},"status":{"const":"planned_not_implemented"}},"required":["status","implementation_evidence_status"],"type":"object"},"obligations":{"items":{"items":false,"maxItems":4,"minItems":4,"prefixItems":[{"minLength":1,"type":"string"},{"enum":["pcfa04_requirement","pcfa04_consulting_craft","pcfa05_stage","pcfa05_invariant","pcfa05_negative_case","pcfa05_founder_interrupt","pcfa06_capability"]},{"items":{"pattern":"^P(?:[1-9]|1[0-2])\\.[1-9][0-9]*$","type":"string"},"minItems":1,"type":"array","uniqueItems":true},{"pattern":"^PCFA07-TST-[A-Z0-9-]+$","type":"string"}],"type":"array"},"maxItems":93,"minItems":93,"type":"array"},"owner":{"const":"Founder"},"reconciliation_id":{"const":"CODEX-IMPLEMENTATION-BACKLOG-RECONCILIATION"},"reconciliation_policy":{"additionalProperties":false,"properties":{"all_statuses_remain_planned_not_implemented":{"const":true},"blocking_gate_is_latest_bound_task_phase":{"const":true},"dependency_tasks_are_prior_bound_tasks":{"const":true},"imp_p0_scope_widened":{"const":false},"implementation_evidence_available":{"const":false},"no_new_imp_phases":{"const":true},"no_new_imp_tasks":{"const":true},"one_planned_test_per_obligation":{"const":true},"pcfa08_final_acceptance_required":{"const":true},"phase0_obligation_count":{"const":0},"planned_test_registry_is_pcfa07_specific":{"const":true},"planned_tests_are_not_executed_evidence":{"const":true}},"required":["no_new_imp_phases","no_new_imp_tasks","imp_p0_scope_widened","phase0_obligation_count","one_planned_test_per_obligation","planned_tests_are_not_executed_evidence","planned_test_registry_is_pcfa07_specific","blocking_gate_is_latest_bound_task_phase","dependency_tasks_are_prior_bound_tasks","all_statuses_remain_planned_not_implemented","implementation_evidence_available","pcfa08_final_acceptance_required"],"type":"object"},"repository":{"const":"rayrayxing/offdata-os"},"schema_version":{"const":"1.0.0"},"source_authorities":{"additionalProperties":false,"properties":{"component_contract":{"const":"contracts/northstar-integration-blueprint.json"},"hermes_bounded_adoption":{"const":"repository/pcfa06-hermes-bounded-adoption-refresh.json"},"implementation_backlog":{"const":"docs/11-BUILD-BACKLOG.md"},"mvcl":{"const":"repository/pcfa05-minimum-valuable-consulting-loop.json"},"product_scope":{"const":"repository/pcfa04-product-scope-implementation-addendum.json"}},"required":["product_scope","mvcl","hermes_bounded_adoption","implementation_backlog","component_contract"],"type":"object"},"source_digests":{"additionalProperties":false,"properties":{"component_contract_sha256":{"pattern":"^[0-9a-f]{64}$","type":"string"},"hermes_bounded_adoption_sha256":{"pattern":"^[0-9a-f]{64}$","type":"string"},"implementation_backlog_sha256":{"pattern":"^[0-9a-f]{64}$","type":"string"},"mvcl_sha256":{"pattern":"^[0-9a-f]{64}$","type":"string"},"product_scope_sha256":{"pattern":"^[0-9a-f]{64}$","type":"string"}},"required":["product_scope_sha256","mvcl_sha256","hermes_bounded_adoption_sha256","implementation_backlog_sha256","component_contract_sha256"],"type":"object"},"status":{"const":"repository_reconciliation_complete_planned_not_implemented"},"task_component_map":{"additionalProperties":{"items":{"pattern":"^COMP-[A-Z0-9-]+$","type":"string"},"minItems":1,"type":"array","uniqueItems":true},"minProperties":1,"type":"object"},"title":{"const":"Codex implementation backlog reconciliation"},"work_package_id":{"const":"PCFA-07"}},"required":["schema_version","work_package_id","reconciliation_id","title","repository","status","owner","generated_from","source_authorities","source_digests","expected_counts","reconciliation_policy","obligation_counts","obligation_columns","obligations","backlog_projection","boundaries","obligation_defaults","kind_metadata","derivation_rules","task_component_map"],"title":"offdata PCFA-07 Codex implementation backlog reconciliation","type":"object"}
