{"backlog_projection":{"existing_imp_phase_count":13,"existing_task_count":53,"new_imp_phase_count":0,"new_task_count":0,"phase0_new_obligation_count":0,"phase0_tasks_unchanged":["P0.1","P0.2","P0.3","P0.4"]},"boundaries":{"autonomous_merge_authorized":false,"codex_start_authorized":false,"external_actions_authorized":false,"founder_accountability_preserved":true,"hermes_activation_authorized":false,"merge_authorized":false,"oauth_authorized":false,"paid_services_authorized":false,"phase0_implementation_authorized":false,"phase0_merge_authorized":false,"phase1_authorized":false,"production_deployment_authorized":false,"real_client_data_enabled":false,"runtime_activation_authorized":false},"derivation_rules":{"blocking_phase_gate":"IMP phase of primary_implementation_task","component_bindings":"ordered union of task_component_map entries for task_bindings","dependency_tasks":"all task_bindings entries before primary","primary_implementation_task":"last task_bindings entry"},"expected_counts":{"pcfa04_requirements":29,"pcfa05_founder_interrupts":6,"pcfa05_invariants":15,"pcfa05_negative_cases":13,"pcfa05_stages":19,"pcfa06_capabilities":11,"planned_tests":93,"total_obligations":93},"generated_from":"configs/pcfa07-codex-implementation-backlog-reconciliation.yaml","kind_metadata":{"pcfa04_consulting_craft":{"evidence_type":"consulting_quality_evaluation_evidence","source_work_package":"PCFA-04"},"pcfa04_requirement":{"evidence_type":"product_scope_acceptance_evidence","source_work_package":"PCFA-04"},"pcfa05_founder_interrupt":{"evidence_type":"founder_interrupt_acceptance_evidence","source_work_package":"PCFA-05"},"pcfa05_invariant":{"evidence_type":"mvcl_invariant_evidence","source_work_package":"PCFA-05"},"pcfa05_negative_case":{"evidence_type":"mvcl_negative_path_execution_evidence","source_work_package":"PCFA-05"},"pcfa05_stage":{"evidence_type":"mvcl_stage_execution_evidence","source_work_package":"PCFA-05"},"pcfa06_capability":{"evidence_type":"hermes_adapter_conformance_evidence","source_work_package":"PCFA-06"}},"obligation_columns":["requirement_id","obligation_kind","task_bindings","planned_test_id"],"obligation_counts":{"pcfa04_requirements":29,"pcfa05_founder_interrupts":6,"pcfa05_invariants":15,"pcfa05_negative_cases":13,"pcfa05_stages":19,"pcfa06_capabilities":11,"planned_tests":93,"total_obligations":93},"obligation_defaults":{"implementation_evidence_status":"not_available_pre_implementation","status":"planned_not_implemented"},"obligations":[["PS-MANDATE-001","pcfa04_requirement",["P2.2","P2.4","P4.1","P5.1"],"PCFA07-TST-PS-MANDATE-001"],["PS-ENGAGEMENT-001","pcfa04_requirement",["P2.4","P3.4","P4.1","P5.3","P6.4","P7.1"],"PCFA07-TST-PS-ENGAGEMENT-001"],["PS-QA-001","pcfa04_requirement",["P2.3","P3.4","P4.4","P5.4","P6.4","P7.5","P11.3"],"PCFA07-TST-PS-QA-001"],["PS-IMPLEMENTATION-001","pcfa04_requirement",["P2.2","P3.2","P3.4","P12.3"],"PCFA07-TST-PS-IMPLEMENTATION-001"],["PS-INGEST-001","pcfa04_requirement",["P1.1","P1.2","P1.5","P5.2","P5.3"],"PCFA07-TST-PS-INGEST-001"],["PS-LOCATOR-001","pcfa04_requirement",["P1.1","P1.2","P1.5","P5.2","P5.3"],"PCFA07-TST-PS-LOCATOR-001"],["PS-LIBRARY-001","pcfa04_requirement",["P1.3","P1.4","P1.5","P12.3"],"PCFA07-TST-PS-LIBRARY-001"],["CQ-DECISION","pcfa04_consulting_craft",["P4.4","P7.1","P7.5","P12.3"],"PCFA07-TST-CQ-DECISION"],["CQ-ANSWER","pcfa04_consulting_craft",["P4.4","P7.1","P7.5","P12.3"],"PCFA07-TST-CQ-ANSWER"],["CQ-TITLE","pcfa04_consulting_craft",["P4.4","P7.1","P7.5","P12.3"],"PCFA07-TST-CQ-TITLE"],["CQ-STORY","pcfa04_consulting_craft",["P4.4","P7.1","P7.5","P12.3"],"PCFA07-TST-CQ-STORY"],["CQ-MECE","pcfa04_consulting_craft",["P4.4","P7.1","P7.5","P12.3"],"PCFA07-TST-CQ-MECE"],["CQ-ALT","pcfa04_consulting_craft",["P4.4","P7.1","P7.5","P12.3"],"PCFA07-TST-CQ-ALT"],["CQ-UNCERT","pcfa04_consulting_craft",["P4.4","P7.1","P7.5","P12.3"],"PCFA07-TST-CQ-UNCERT"],["CQ-DENSITY","pcfa04_consulting_craft",["P4.4","P7.1","P7.5","P12.3"],"PCFA07-TST-CQ-DENSITY"],["CQ-VISUAL","pcfa04_consulting_craft",["P4.4","P7.1","P7.5","P12.3"],"PCFA07-TST-CQ-VISUAL"],["CQ-HIER","pcfa04_consulting_craft",["P4.4","P7.1","P7.5","P12.3"],"PCFA07-TST-CQ-HIER"],["CQ-REDUND","pcfa04_consulting_craft",["P4.4","P7.1","P7.5","P12.3"],"PCFA07-TST-CQ-REDUND"],["CQ-ACTION","pcfa04_consulting_craft",["P4.4","P7.1","P7.5","P12.3"],"PCFA07-TST-CQ-ACTION"],["CQ-RISK","pcfa04_consulting_craft",["P4.4","P7.1","P7.5","P12.3"],"PCFA07-TST-CQ-RISK"],["CQ-AUDIENCE","pcfa04_consulting_craft",["P4.4","P7.1","P7.5","P12.3"],"PCFA07-TST-CQ-AUDIENCE"],["CQ-EXEC","pcfa04_consulting_craft",["P4.4","P7.1","P7.5","P12.3"],"PCFA07-TST-CQ-EXEC"],["PS-GOLDEN-001","pcfa04_requirement",["P7.5","P12.1","P12.2","P12.3"],"PCFA07-TST-PS-GOLDEN-001"],["PS-ROUNDTRIP-001","pcfa04_requirement",["P7.3","P7.5","P12.3"],"PCFA07-TST-PS-ROUNDTRIP-001"],["PS-STYLE-001","pcfa04_requirement",["P2.2","P7.1","P7.2","P7.3","P12.3"],"PCFA07-TST-PS-STYLE-001"],["PS-ASSET-RIGHTS-001","pcfa04_requirement",["P1.1","P7.2","P7.3","P7.4","P7.5","P11.2"],"PCFA07-TST-PS-ASSET-RIGHTS-001"],["PS-FOUNDER-ATTENTION-001","pcfa04_requirement",["P2.3","P3.3","P12.3"],"PCFA07-TST-PS-FOUNDER-ATTENTION-001"],["PS-DELIVERABLE-VARIANTS-001","pcfa04_requirement",["P7.1","P7.3","P7.5"],"PCFA07-TST-PS-DELIVERABLE-VARIANTS-001"],["PS-REVIEW-001","pcfa04_requirement",["P2.2","P2.3","P3.2","P3.4","P7.5"],"PCFA07-TST-PS-REVIEW-001"],["MVCL-01","pcfa05_stage",["P2.2","P8.4","P9.2","P9.3"],"PCFA07-TST-MVCL-01"],["MVCL-02","pcfa05_stage",["P2.2","P2.4","P4.1","P5.1"],"PCFA07-TST-MVCL-02"],["MVCL-03","pcfa05_stage",["P2.1","P2.2","P3.1","P3.2"],"PCFA07-TST-MVCL-03"],["MVCL-04","pcfa05_stage",["P2.2","P4.1","P4.2","P4.4"],"PCFA07-TST-MVCL-04"],["MVCL-05","pcfa05_stage",["P4.2","P4.4","P5.1"],"PCFA07-TST-MVCL-05"],["MVCL-06","pcfa05_stage",["P5.1"],"PCFA07-TST-MVCL-06"],["MVCL-07","pcfa05_stage",["P1.1","P1.2","P5.2","P5.4","P11.3"],"PCFA07-TST-MVCL-07"],["MVCL-08","pcfa05_stage",["P2.2","P5.3","P5.4"],"PCFA07-TST-MVCL-08"],["MVCL-09","pcfa05_stage",["P1.4","P1.5","P4.2","P4.4"],"PCFA07-TST-MVCL-09"],["MVCL-10","pcfa05_stage",["P6.1","P6.2","P6.4"],"PCFA07-TST-MVCL-10"],["MVCL-11","pcfa05_stage",["P4.2","P4.4","P6.2","P7.1"],"PCFA07-TST-MVCL-11"],["MVCL-12","pcfa05_stage",["P2.2","P4.2","P4.4","P6.4"],"PCFA07-TST-MVCL-12"],["MVCL-13","pcfa05_stage",["P2.2","P2.3","P3.3","P3.4"],"PCFA07-TST-MVCL-13"],["MVCL-14","pcfa05_stage",["P4.2","P4.4","P7.1"],"PCFA07-TST-MVCL-14"],["MVCL-15","pcfa05_stage",["P7.1","P7.2","P7.3","P7.4","P7.5"],"PCFA07-TST-MVCL-15"],["MVCL-16","pcfa05_stage",["P4.4","P5.4","P6.4","P7.5","P11.3"],"PCFA07-TST-MVCL-16"],["MVCL-17","pcfa05_stage",["P2.2","P3.2","P3.4","P12.3"],"PCFA07-TST-MVCL-17"],["MVCL-18","pcfa05_stage",["P2.2","P6.4","P12.3"],"PCFA07-TST-MVCL-18"],["MVCL-19","pcfa05_stage",["P2.3","P3.4","P10.3","P10.4","P12.3","P12.4"],"PCFA07-TST-MVCL-19"],["MVCL-INV-ENGAGEMENT-ID","pcfa05_invariant",["P2.1","P2.2","P8.4","P12.3"],"PCFA07-TST-MVCL-INV-ENGAGEMENT-ID"],["MVCL-INV-CANONICAL-STATE","pcfa05_invariant",["P2.2","P2.3","P3.1","P12.3"],"PCFA07-TST-MVCL-INV-CANONICAL-STATE"],["MVCL-INV-CLAIM-TRACE","pcfa05_invariant",["P5.3","P5.4","P12.3"],"PCFA07-TST-MVCL-INV-CLAIM-TRACE"],["MVCL-INV-NUMBER-REPRO","pcfa05_invariant",["P6.1","P6.4","P12.3"],"PCFA07-TST-MVCL-INV-NUMBER-REPRO"],["MVCL-INV-CONTRARY-EVIDENCE","pcfa05_invariant",["P5.3","P5.4","P12.3"],"PCFA07-TST-MVCL-INV-CONTRARY-EVIDENCE"],["MVCL-INV-METHOD-JUSTIFICATION","pcfa05_invariant",["P1.4","P4.2","P4.4","P12.3"],"PCFA07-TST-MVCL-INV-METHOD-JUSTIFICATION"],["MVCL-INV-IDEMPOTENCY","pcfa05_invariant",["P3.2","P3.3","P12.3"],"PCFA07-TST-MVCL-INV-IDEMPOTENCY"],["MVCL-INV-EXACT-APPROVAL","pcfa05_invariant",["P2.3","P3.3","P3.4","P12.3"],"PCFA07-TST-MVCL-INV-EXACT-APPROVAL"],["MVCL-INV-RESTART-SAFE","pcfa05_invariant",["P3.2","P3.4","P12.3"],"PCFA07-TST-MVCL-INV-RESTART-SAFE"],["MVCL-INV-INDEPENDENT-QA","pcfa05_invariant",["P4.4","P5.4","P6.4","P7.5","P11.3","P12.3"],"PCFA07-TST-MVCL-INV-INDEPENDENT-QA"],["MVCL-INV-CROSS-FORMAT","pcfa05_invariant",["P7.3","P7.5","P12.3"],"PCFA07-TST-MVCL-INV-CROSS-FORMAT"],["MVCL-INV-REC-TO-BENEFIT","pcfa05_invariant",["P2.2","P3.2","P12.3"],"PCFA07-TST-MVCL-INV-REC-TO-BENEFIT"],["MVCL-INV-AUDIT-HISTORY","pcfa05_invariant",["P2.3","P3.2","P11.2","P12.3"],"PCFA07-TST-MVCL-INV-AUDIT-HISTORY"],["MVCL-INV-FOUNDER-CONTROL","pcfa05_invariant",["P3.3","P3.4","P12.3"],"PCFA07-TST-MVCL-INV-FOUNDER-CONTROL"],["MVCL-INV-NO-SELF-APPROVAL","pcfa05_invariant",["P3.3","P4.4","P11.3","P12.3"],"PCFA07-TST-MVCL-INV-NO-SELF-APPROVAL"],["MVCL-NEG-01","pcfa05_negative_case",["P5.3","P5.4","P12.2"],"PCFA07-TST-MVCL-NEG-01"],["MVCL-NEG-02","pcfa05_negative_case",["P5.3","P5.4","P12.2"],"PCFA07-TST-MVCL-NEG-02"],["MVCL-NEG-03","pcfa05_negative_case",["P3.2","P3.3","P12.2"],"PCFA07-TST-MVCL-NEG-03"],["MVCL-NEG-04","pcfa05_negative_case",["P2.3","P3.3","P12.2"],"PCFA07-TST-MVCL-NEG-04"],["MVCL-NEG-05","pcfa05_negative_case",["P3.2","P12.2"],"PCFA07-TST-MVCL-NEG-05"],["MVCL-NEG-06","pcfa05_negative_case",["P3.2","P3.3","P12.2"],"PCFA07-TST-MVCL-NEG-06"],["MVCL-NEG-07","pcfa05_negative_case",["P3.2","P3.4","P12.2"],"PCFA07-TST-MVCL-NEG-07"],["MVCL-NEG-08","pcfa05_negative_case",["P7.5","P11.3","P12.2"],"PCFA07-TST-MVCL-NEG-08"],["MVCL-NEG-09","pcfa05_negative_case",["P2.1","P11.3","P12.2"],"PCFA07-TST-MVCL-NEG-09"],["MVCL-NEG-10","pcfa05_negative_case",["P1.2","P5.2","P11.3","P12.2"],"PCFA07-TST-MVCL-NEG-10"],["MVCL-NEG-11","pcfa05_negative_case",["P4.3","P4.4","P12.2"],"PCFA07-TST-MVCL-NEG-11"],["MVCL-NEG-12","pcfa05_negative_case",["P6.4","P12.2"],"PCFA07-TST-MVCL-NEG-12"],["MVCL-NEG-13","pcfa05_negative_case",["P7.5","P12.2"],"PCFA07-TST-MVCL-NEG-13"],["MVCL-FI-01","pcfa05_founder_interrupt",["P2.2","P2.4","P3.3","P3.4","P12.3"],"PCFA07-TST-MVCL-FI-01"],["MVCL-FI-02","pcfa05_founder_interrupt",["P3.3","P4.4","P5.4","P11.3","P12.3"],"PCFA07-TST-MVCL-FI-02"],["MVCL-FI-03","pcfa05_founder_interrupt",["P2.3","P3.3","P3.4","P12.3"],"PCFA07-TST-MVCL-FI-03"],["MVCL-FI-04","